[
  {
    "id": "opticstudio",
    "name": "Ansys Zemax OpticStudio",
    "group": "paid",
    "cats": [
      "ray",
      "wave"
    ],
    "method": "顺序 / 非顺序光线追迹；物理光学传播",
    "summary": "镜头、成像像差、公差、杂散光和部分相干传播的综合设计环境。",
    "api": "ZOS-API .NET；Python、C#、C++、MATLAB；ZPL 宏；支持 Standalone 与交互连接。",
    "license": "商业授权；学术许可、模块与并发求解按合同配置",
    "compute": "以 Windows 主程序为中心；后台实例仍需有效许可",
    "usage": "厂商提供镜头、成像与照明工程应用及自动化示例。",
    "limit": "顺序光学、非顺序光学和 POP 的模型与数据接口不同；社区 MCP 的覆盖范围不能等同于全部 ZOS-API。",
    "sources": [
      {
        "label": "官方 API 与示例",
        "url": "https://optics.ansys.com/hc/en-us/articles/42661773562899-Sample-code-for-ZOS-API-users"
      },
      {
        "label": "官方连接模式",
        "url": "https://optics.ansys.com/hc/en-us/articles/42661790380179-ZOS-API-NET-An-Overview"
      }
    ],
    "route": "api",
    "mcp": {
      "kind": "community",
      "text": "OpticStudioMCPServer；通过 ZOS-API 控制，社区实现",
      "url": "https://github.com/jaruiz6363/OpticStudioMCPServer"
    },
    "skill": {
      "kind": "unverified",
      "text": "本次未核实专用 Agent Skill"
    },
    "stage": "成熟工具"
  },
  {
    "id": "codev",
    "name": "Keysight CODE V",
    "group": "paid",
    "cats": [
      "ray",
      "wave"
    ],
    "method": "成像光学设计与优化",
    "summary": "镜头初始设计、像差优化、公差分析和成像性能评估。",
    "api": "Macro-PLUS 脚本、命令与批量设计流程；具体外部自动化接口以安装版文档为准。",
    "license": "商业授权；学术许可、模块与并发求解按合同配置",
    "compute": "本地授权软件；宏脚本驱动",
    "usage": "Keysight 官方成像光学产品，提供镜头及手机相机设计工作流。",
    "limit": "旧资料多标为 Synopsys CODE V；应按当前 Keysight 产品与文档查找。",
    "sources": [
      {
        "label": "产品与 Macro-PLUS",
        "url": "https://www.keysight.com.cn/cn/zh/products/software/optical-solutions-software/optical-design-solutions/codev.html"
      }
    ],
    "route": "script",
    "mcp": {
      "kind": "unverified",
      "text": "本次未核实专用 MCP"
    },
    "skill": {
      "kind": "unverified",
      "text": "本次未核实专用 Agent Skill"
    },
    "stage": "成熟工具"
  },
  {
    "id": "lighttools",
    "name": "Keysight LightTools",
    "group": "paid",
    "cats": [
      "ray"
    ],
    "method": "非顺序光线追迹 / 照明",
    "summary": "照明、导光、显示与杂散光；包含材料、散射和光源建模。",
    "api": "内置宏与 LTAPI 自动化；有第三方 Python 封装。",
    "license": "商业授权；学术许可、模块与并发求解按合同配置",
    "compute": "以桌面授权实例为中心",
    "usage": "官方照明产品；有 CODE V → LightTools 的联合设计工作流。",
    "limit": "Python 封装与主程序分别维护；光源和 BSDF 数据质量直接影响结果。",
    "sources": [
      {
        "label": "官方产品",
        "url": "https://www.keysight.com/es/en/products/software/optical-solutions-software/optical-design-solutions/lighttools.html"
      },
      {
        "label": "社区 Python 接口",
        "url": "https://github.com/Mestas/Lighttools"
      }
    ],
    "route": "api",
    "mcp": {
      "kind": "unverified",
      "text": "本次未核实专用 MCP"
    },
    "skill": {
      "kind": "unverified",
      "text": "本次未核实专用 Agent Skill"
    },
    "stage": "成熟工具"
  },
  {
    "id": "fred",
    "name": "FRED",
    "group": "paid",
    "cats": [
      "ray",
      "wave"
    ],
    "method": "非顺序追迹；相干与非相干光学",
    "summary": "复杂光机系统、散射、杂散光和激光系统的传播分析。",
    "api": "内置脚本与 .frs 工作流；官方给出追迹—分析循环示例。",
    "license": "商业授权；另有需申请的大学免费许可，适用条件见官方页面",
    "compute": "Windows；按版本支持多线程、分布式或 FREDmpc GPU 计算",
    "usage": "Photon Engineering 的工程产品，公开提供可执行脚本案例。",
    "limit": "已核实内置脚本；本表不把它标成完整、原生的 Python API。",
    "sources": [
      {
        "label": "官方脚本循环",
        "url": "https://support.photonengr.com/article/176-raytrace-and-analysis-loop"
      },
      {
        "label": "官方产品概览",
        "url": "https://photonengr.com/"
      },
      {
        "label": "学术使用与免费申请条件",
        "url": "https://photonengr.com/academic-licenses"
      }
    ],
    "route": "script",
    "mcp": {
      "kind": "unverified",
      "text": "本次未核实专用 MCP"
    },
    "skill": {
      "kind": "unverified",
      "text": "本次未核实专用 Agent Skill"
    },
    "stage": "成熟工具"
  },
  {
    "id": "tracepro",
    "name": "TracePro",
    "group": "paid",
    "cats": [
      "ray"
    ],
    "method": "蒙特卡洛光线追迹",
    "summary": "照明、杂散光、光通量与光机几何的分析和优化。",
    "api": "Scheme 宏；手册提供 DDE 与宏自动化说明。",
    "license": "商业授权；学术许可、模块与并发求解按合同配置",
    "compute": "桌面程序；宏 / DDE 桥接",
    "usage": "Lambda Research 官方工程产品和 2026 用户手册。",
    "limit": "复杂桌面会话的生命周期需要额外管理；脚本接口不是 MCP。",
    "sources": [
      {
        "label": "2026 官方用户手册",
        "url": "https://lambdares.com/hubfs/TracePro_Users_Manual_2026.pdf"
      },
      {
        "label": "官方支持",
        "url": "https://lambdares.com/tracepro-2"
      }
    ],
    "route": "script",
    "mcp": {
      "kind": "unverified",
      "text": "本次未核实专用 MCP"
    },
    "skill": {
      "kind": "unverified",
      "text": "本次未核实专用 Agent Skill"
    },
    "stage": "成熟工具"
  },
  {
    "id": "oslo",
    "name": "OSLO",
    "group": "paid",
    "cats": [
      "ray"
    ],
    "method": "顺序光学 / 镜头设计",
    "summary": "光学系统布局、像差、优化和公差计算。",
    "api": "CCL 编程与命令体系；具体功能取决于版本。",
    "license": "商业授权；学术许可、模块与并发求解按合同配置",
    "compute": "Windows；CCL 脚本",
    "usage": "Lambda Research 的镜头设计产品；另有独立 EDU 免费版本。",
    "limit": "商业版与 EDU 不能混为同一功能集合；免费版单列。",
    "sources": [
      {
        "label": "官方产品",
        "url": "https://lambdares.com/oslo"
      },
      {
        "label": "教育版说明",
        "url": "https://lambdares.com/edu"
      },
      {
        "label": "官方 CCL 编程手册",
        "url": "https://lambdares.com/hubfs/Support/support/oslo/oslo_releases/OSLOProgramReference.pdf"
      }
    ],
    "route": "script",
    "mcp": {
      "kind": "unverified",
      "text": "本次未核实专用 MCP"
    },
    "skill": {
      "kind": "unverified",
      "text": "本次未核实专用 Agent Skill"
    },
    "stage": "成熟工具"
  },
  {
    "id": "asap",
    "name": "ASAP",
    "group": "paid",
    "cats": [
      "ray",
      "wave"
    ],
    "method": "非顺序光学 / 物理光学",
    "summary": "复杂光学系统、照明、散射与杂散光分析。",
    "api": "官方集成 Python、VBScript 等脚本支持；可编写自动化分析流程。",
    "license": "商业授权；学术许可、模块与并发求解按合同配置",
    "compute": "授权桌面 / 求解环境",
    "usage": "Breault Research Organization 官方光学分析产品。",
    "limit": "脚本宿主、对象模型和授权配置要与实际版本匹配。",
    "sources": [
      {
        "label": "官方功能与脚本",
        "url": "https://breault.com/asap/"
      }
    ],
    "route": "script",
    "mcp": {
      "kind": "unverified",
      "text": "本次未核实专用 MCP"
    },
    "skill": {
      "kind": "unverified",
      "text": "本次未核实专用 Agent Skill"
    },
    "stage": "成熟工具"
  },
  {
    "id": "virtuallab",
    "name": "VirtualLab Fusion",
    "group": "paid",
    "cats": [
      "wave",
      "ray",
      "periodic"
    ],
    "method": "场追迹 / 混合光学建模",
    "summary": "衍射、偏振、光栅、自由空间系统和复杂光学元件的联合建模。",
    "api": "官方 Programming API、可编程元件与脚本；官方说明可扩展 Python / MATLAB 工作流。",
    "license": "商业授权；学术许可、模块与并发求解按合同配置",
    "compute": "Windows；产品内编程与外部工作流",
    "usage": "LightTrans 官方波动光学平台；提供数字光学元件与应用库。",
    "limit": "不同求解器之间传递的是特定场表示；不能把所有混合计算视为一次全波 Maxwell 求解。",
    "sources": [
      {
        "label": "编程 API",
        "url": "https://programmingreference.lighttrans.com/2026.2/api/VirtualLab.Programming.html"
      },
      {
        "label": "官方说明",
        "url": "https://www.lighttrans.com/product/virtuallab-fusion/frequently-asked-questions/general-faqs.html"
      }
    ],
    "route": "api",
    "mcp": {
      "kind": "unverified",
      "text": "本次未核实专用 MCP"
    },
    "skill": {
      "kind": "unverified",
      "text": "本次未核实专用 Agent Skill"
    },
    "stage": "成熟工具"
  },
  {
    "id": "speos",
    "name": "Ansys Speos",
    "group": "paid",
    "cats": [
      "ray",
      "imaging"
    ],
    "method": "光线输运 / 光度与视觉仿真",
    "summary": "照明、车灯、显示、传感器与人眼视觉相关的光机设计。",
    "api": "Speos 脚本；Ansys optical-automation 提供公开 Python 自动化与互操作代码。",
    "license": "商业授权；学术许可、模块与并发求解按合同配置",
    "compute": "与 Ansys / CAD 产品环境配合",
    "usage": "Ansys 工程产品；官方维护光学自动化代码。",
    "limit": "MIT 许可的是自动化库，不是 Speos 求解器；不同宿主可能使用 IronPython 或 CPython。",
    "sources": [
      {
        "label": "官方自动化说明",
        "url": "https://optics.ansys.com/hc/en-us/articles/24752772596371-Optical-Automation-library-introduction"
      },
      {
        "label": "自动化源码",
        "url": "https://github.com/ansys/optical-automation"
      }
    ],
    "route": "api",
    "mcp": {
      "kind": "unverified",
      "text": "本次未核实专用 MCP"
    },
    "skill": {
      "kind": "unverified",
      "text": "本次未核实专用 Agent Skill"
    },
    "stage": "成熟工具"
  },
  {
    "id": "lumerical",
    "name": "Ansys Lumerical",
    "group": "paid",
    "cats": [
      "em",
      "pic",
      "periodic"
    ],
    "method": "FDTD / 模态 / 多物理场 / 光子电路",
    "summary": "FDTD、MODE、Multiphysics 与 INTERCONNECT 组成器件到电路的产品族。",
    "api": "lumapi Python；LSF 脚本；lumopt 逆向设计；lumslurm 调度。",
    "license": "商业授权；学术许可、模块与并发求解按合同配置",
    "compute": "本地 / 集群；产品与 HPC 授权分别配置",
    "usage": "官方应用库涵盖纳米光学、硅光器件和光收发链路。",
    "limit": "Python 客户端和 MCP 不能替代求解器授权；不同产品的物理模型与输出不同。",
    "sources": [
      {
        "label": "官方 Python API",
        "url": "https://optics.ansys.com/hc/en-us/articles/360037824513-Python-API-overview"
      },
      {
        "label": "Ansys 官方 MCP 源码",
        "url": "https://github.com/ansys/pylumerical-mcp"
      }
    ],
    "route": "api",
    "mcp": {
      "kind": "official",
      "text": "Ansys 官方组织发布 PyLumerical MCP",
      "url": "https://github.com/ansys/pylumerical-mcp"
    },
    "skill": {
      "kind": "community",
      "text": "Lumerical_MCP_Skill；社区技能与连接器",
      "url": "https://github.com/zxqcreations/Lumerical_MCP_Skill"
    },
    "stage": "成熟工具"
  },
  {
    "id": "comsol",
    "name": "COMSOL Multiphysics",
    "group": "paid",
    "cats": [
      "em",
      "ray",
      "laser"
    ],
    "method": "FEM / 射线 / 多物理场",
    "summary": "波动光学、射线光学与热、结构、电荷等耦合；适合热光和应力光学模型。",
    "api": "官方 Java API、批处理；LiveLink for MATLAB；Python 可通过第三方桥接。",
    "license": "商业授权；学术许可、模块与并发求解按合同配置",
    "compute": "Windows / Linux / macOS；批处理与服务器按许可",
    "usage": "官方 API 与多物理场建模平台；光学功能需要对应模块。",
    "limit": "不要将第三方 Python 包说成官方 Python API；光学、热学、CAD 与并行许可需具体匹配。",
    "sources": [
      {